slug,series,title,date,last_edited,tags,excerpt,lang,fileName,cover
post-07,vulkan,Core Concepts in Vulkan and Their Meanings,2026-02-09T01:26:00,2026-02-15T01:23:00,vulkan,,en,07-vulkan-core-concepts.md,https://external-content.duckduckgo.com/iu/?u=https%3A%2F%2Fi.ytimg.com%2Fvi%2F2NVlG9TFT1c%2Fmaxresdefault.jpg&f=1&nofb=1&ipt=1bc48266157d288817a9fdf26479c7009f947736ff5e91538c17a7f2afed3274
post-06,vulkan,Setting Up Vulkan on macOS,2026-01-14T01:26:00,2026-02-15,🦀rust|vulkan,Essential setup guide for macOS when working with Rust and Vulkan.,en,06-setup-vulkan-rust-macOS.md,https://encrypted-tbn0.gstatic.com/images?q=tbn:ANd9GcTd4hxsajtTMpwD_kEhUspdjSJIWLGtE22c5g&s
post-03,productivity,Boosting Productivity with Terminal,2026-01-01T22:25:00,2026-02-15,productivity,What is Terminal? Practical applications of Terminal usage.,en,03-mac-terminal.md,https://github.com/hoangcuongzk1/hoangcuongzk1.github.io/blob/main/docs/shared/post-03/my_terminal_preview.png?raw=true
post-05,rust,Installing Rust on MacOS,2026-01-01T01:26:00,2026-02-15,🦀rust,A comprehensive guide to installing Rust on macOS,en,05-install-rust-macOS.md,https://i.ytimg.com/vi/yt8ujLidMYE/sddefault.jpg?sqp=-oaymwEmCIAFEOAD8quKqQMa8AEB-AH-CYAC0AWKAgwIABABGEAgTyhyMA8=&rs=AOn4CLDpJbU3fCmn2jrNXH5TZ5CthPFqxg
post-04,rust,A compilation of resources for learning Rust,2026-01-01T01:02:00,2026-02-15,🦀rust,"Collections of the web, youtube channel, book,... to learn Rust.",en,04-rust-documents.md,https://addons.mozilla.org/user-media/previews/full/231/231838.png?modified=1622134884
post-02,computer-hardwares,Punch card machine,2025-12-13T05:56:00,2026-02-15,hardware,How punch cards work.,en,02-how-punch-card-works.md,https://twobithistory.org/images/ibm029_front.jpg
post-01,talk,First Post,2025-12-09T01:15:00,2025-12-09T01:15:00,talk,"Why This Website Exists, and What It Will Contain.",en,01-first-post.md,https://cdn11.bigcommerce.com/s-8e25iavqdi/images/stencil/1280x1280/products/121929/138853/the-hobbit-an-unexpected-journey-4-cover-art-sticker-ACF054879__04107.1650926362.jpg?c=2
post-00,debug,Test Post Rendering,2025-12-08T01:26:00,2026-02-15T05:05:00,test,Test Post Rendering from markdown to HTML.,en,00-test.md,https://i.pinimg.com/originals/82/71/47/82714763ab84910774a889d31ca8e4c1.gif