slug,series,title,date,tags,excerpt,lang,fileName,cover
post-03,productivity,Boosting Productivity with Terminal,2026-01-01T22:25:00,productivity,What is Terminal? Practical applications of Terminal usage.,en,03-mac-terminal.md,https://github.com/hoangcuongzk1/hoangcuongzk1.github.io/blob/main/docs/shared/post-03/my_terminal_preview.png?raw=true
post-04,rust-graphic,Installing Rust on MacOS,2026-01-01T01:26:00,🦀rust,A comprehensive guide to installing Rust on macOS,en,04-install-rust-macOS.md,https://i.ytimg.com/vi/yt8ujLidMYE/sddefault.jpg?sqp=-oaymwEmCIAFEOAD8quKqQMa8AEB-AH-CYAC0AWKAgwIABABGEAgTyhyMA8=&rs=AOn4CLDpJbU3fCmn2jrNXH5TZ5CthPFqxg
post-02,computer-hardwares,Punch card machine,2025-12-13T05:56:00,hardware,How punch cards work.,en,02-how-punch-card-works.md,https://twobithistory.org/images/ibm029_front.jpg
post-01,talk,First Post,2025-12-09T01:15:00,talk,"Why This Website Exists, and What It Will Contain.",en,01-first-post.md,https://cdn11.bigcommerce.com/s-8e25iavqdi/images/stencil/1280x1280/products/121929/138853/the-hobbit-an-unexpected-journey-4-cover-art-sticker-ACF054879__04107.1650926362.jpg?c=2
post-00,debug,Test Post Rendering,2025-12-08T01:26:00,test,Test Post Rendering from markdown to HTML.,en,00-test.md,https://i.pinimg.com/originals/82/71/47/82714763ab84910774a889d31ca8e4c1.gif